{
  "$schema": "./mil-hdbk-217f-evidence.schema.json",
  "schema_version": 1,
  "catalog_id": "mil-hdbk-217f-notice-2-evidence",
  "reviewed_on": "2026-07-18",
  "policy": {
    "reference_directory": "docs/references",
    "metadata_only_for_new_sources": true,
    "tracked_pdf_allowlist": [
      {
        "filename": "MIL-HDBK-217F-Notice2.pdf",
        "sha256": "e0df9c9ed1123a790a5b11e4b8dbbc27ff7edc338b417b0b3d6bff8295217f9b",
        "redistribution_status": "tracked_controlled"
      },
      {
        "filename": "AV51DOT1-2013-R2018.pdf",
        "sha256": "444654fd15215fde6e7700a70ecbf1a82001cf368c93b6a1de28dafde072f214",
        "redistribution_status": "tracked_controlled"
      }
    ],
    "source_precedence": [
      "governing_standard",
      "contemporaneous_normative_reference",
      "appendix_c_technical_basis",
      "related_primary_extension",
      "later_or_secondary_context"
    ],
    "availability_statuses": [
      "controlled_tracked",
      "local_untracked",
      "public_external",
      "identified_unavailable"
    ]
  },
  "program_status": {
    "conformance_tier": "verified_handbook_transcription_with_disclosed_repairs",
    "assurance_status": "verified",
    "lineage_evidence": {
      "status": "partial",
      "available_unique": 12,
      "total": 38,
      "missing": 26
    }
  },
  "documents": [
    {
      "id": "mil-hdbk-217f-notice-2",
      "document_number": "MIL-HDBK-217F Notice 2",
      "accession": null,
      "title": "Reliability Prediction of Electronic Equipment",
      "date": "1995-02-28",
      "authority": "United States Department of Defense",
      "authority_role": "governing_standard",
      "relationship": "Controlled governing edition for Perdura's MIL-HDBK-217F calculations.",
      "supports": ["Sections 5-23", "Appendix A", "Appendix B", "Appendix C bibliography"],
      "acquisition_status": "controlled_tracked",
      "identity_status": "verified",
      "review_status": "fully_reviewed",
      "local_files": [{"filename": "MIL-HDBK-217F-Notice2.pdf", "sha256": "e0df9c9ed1123a790a5b11e4b8dbbc27ff7edc338b417b0b3d6bff8295217f9b", "redistribution_status": "tracked_controlled"}],
      "findings": ["Appendix C contains 38 numbered references.", "The scan contains several document-number and accession transcription defects recorded on the affected Appendix C entries."],
      "limitations": ["Handbook transcription parity is not empirical validation for a specific design."]
    },
    {
      "id": "ansi-vita-51-1-2013-r2018",
      "document_number": "ANSI/VITA 51.1-2013 (R2018)",
      "accession": null,
      "title": "Reliability Prediction MIL-HDBK-217 Subsidiary Specification",
      "date": "2018",
      "authority": "VITA Standards Organization",
      "authority_role": "subsidiary_standard",
      "relationship": "Optional calculation-affecting subsidiary rules activated by the A/V51.1 selection.",
      "supports": ["A/V51.1 rules", "Appendix F equations"],
      "acquisition_status": "controlled_tracked",
      "identity_status": "verified",
      "review_status": "fully_reviewed",
      "local_files": [{"filename": "AV51DOT1-2013-R2018.pdf", "sha256": "444654fd15215fde6e7700a70ecbf1a82001cf368c93b6a1de28dafde072f214", "redistribution_status": "tracked_controlled"}],
      "findings": [],
      "limitations": ["Referenced VITA 51.0, VITA 51.2, and RAC methods remain separate sources."]
    },
    {
      "id": "mil-hdbk-217f-base-1991",
      "document_number": "MIL-HDBK-217F",
      "accession": null,
      "title": "Reliability Prediction of Electronic Equipment",
      "date": "1991-12-02",
      "authority": "United States Department of Defense",
      "authority_role": "later_context",
      "relationship": "Base Revision F scan used to distinguish content superseded by Notice 2.",
      "supports": ["Revision history", "pre-Notice-2 comparison"],
      "acquisition_status": "local_untracked",
      "identity_status": "verified",
      "review_status": "identity_verified",
      "local_files": [{"filename": "MIL-HDBK-217F_Reliability_Prediction_of_Electronic_Equipment_2_Dec_1991_pp_200.pdf", "sha256": "132a8f77a077ed1c1125acb39c756bacae05ae16395f8beeb0557667500ef0a9", "redistribution_status": "local_review_only"}],
      "findings": [],
      "limitations": ["Not the governing Notice 2 edition."]
    },
    {
      "id": "mil-std-883-part-1-2019",
      "document_number": "MIL-STD-883-1",
      "accession": null,
      "title": "Environmental Test Methods for Microcircuits, Part 1: Test Methods 1000-1999",
      "date": "2019-09-16",
      "authority": "United States Department of Defense",
      "authority_role": "later_context",
      "relationship": "Later method-volume context for microcircuit screening and environmental tests.",
      "supports": ["MIL-STD-883 method context", "methods 1000-1999"],
      "acquisition_status": "local_untracked",
      "identity_status": "verified",
      "review_status": "context_only",
      "local_files": [{"filename": "MIL-STD-883-1.pdf", "sha256": "42a3f66da4399d0a7426a8cf41063d8659537e493fc07f9041c41aa45e9854bd", "redistribution_status": "public_domain_source_scan"}],
      "findings": ["Part of the five-volume 2019 baseline that superseded MIL-STD-883K Change 3."],
      "limitations": ["Does not establish parity with the MIL-STD-883 revision contemporaneous with the 1995 handbook."]
    },
    {
      "id": "mil-std-883-part-2-2019",
      "document_number": "MIL-STD-883-2",
      "accession": null,
      "title": "Mechanical Test Methods for Microcircuits, Part 2: Test Methods 2000-2999",
      "date": "2019-09-16",
      "authority": "United States Department of Defense",
      "authority_role": "later_context",
      "relationship": "Later method-volume context for microcircuit mechanical tests.",
      "supports": ["MIL-STD-883 method context", "methods 2000-2999"],
      "acquisition_status": "local_untracked",
      "identity_status": "verified",
      "review_status": "context_only",
      "local_files": [{"filename": "MIL-STD-883-2.pdf", "sha256": "30c060d0f23d1d463a878323c739c3bd26e46314b6ab7c8b89060d5f63572954", "redistribution_status": "public_domain_source_scan"}],
      "findings": ["Part of the five-volume 2019 baseline that superseded MIL-STD-883K Change 3."],
      "limitations": ["Does not establish parity with the MIL-STD-883 revision contemporaneous with the 1995 handbook."]
    },
    {
      "id": "mil-std-883-part-3-2019",
      "document_number": "MIL-STD-883-3",
      "accession": null,
      "title": "Electrical Tests (Digital) for Microcircuits, Part 3: Test Methods 3000-3999",
      "date": "2019-09-16",
      "authority": "United States Department of Defense",
      "authority_role": "later_context",
      "relationship": "Later method-volume context for digital electrical tests.",
      "supports": ["MIL-STD-883 method context", "methods 3000-3999"],
      "acquisition_status": "local_untracked",
      "identity_status": "verified",
      "review_status": "context_only",
      "local_files": [{"filename": "MIL-STD-883-3.pdf", "sha256": "cd4aaffb81d9d3517be3fa4c761143482effd86ccf5f8f9f8daec37d87a141cc", "redistribution_status": "public_domain_source_scan"}],
      "findings": ["Part of the five-volume 2019 baseline that superseded MIL-STD-883K Change 3."],
      "limitations": ["Does not establish parity with the MIL-STD-883 revision contemporaneous with the 1995 handbook."]
    },
    {
      "id": "mil-std-883-part-4-2019",
      "document_number": "MIL-STD-883-4",
      "accession": null,
      "title": "Electrical Tests (Linear) for Microcircuits, Part 4: Test Methods 4000-4999",
      "date": "2019-09-16",
      "authority": "United States Department of Defense",
      "authority_role": "later_context",
      "relationship": "Later method-volume context for linear electrical tests.",
      "supports": ["MIL-STD-883 method context", "methods 4000-4999"],
      "acquisition_status": "local_untracked",
      "identity_status": "verified",
      "review_status": "context_only",
      "local_files": [{"filename": "MIL-STD-883-4.pdf", "sha256": "8fd52ec9fbac5f75cc6f49102e7709ca5cb29418c565997a861cd74916bc9ced", "redistribution_status": "public_domain_source_scan"}],
      "findings": ["Part of the five-volume 2019 baseline that superseded MIL-STD-883K Change 3."],
      "limitations": ["Does not establish parity with the MIL-STD-883 revision contemporaneous with the 1995 handbook."]
    },
    {
      "id": "mil-std-883-part-5-2019",
      "document_number": "MIL-STD-883-5",
      "accession": null,
      "title": "Test Procedures for Microcircuits, Part 5: Test Methods 5000-5999",
      "date": "2019-09-16",
      "authority": "United States Department of Defense",
      "authority_role": "later_context",
      "relationship": "Later method-volume context for microcircuit procedures.",
      "supports": ["MIL-STD-883 method context", "methods 5000-5999"],
      "acquisition_status": "local_untracked",
      "identity_status": "verified",
      "review_status": "context_only",
      "local_files": [{"filename": "MIL-STD-883-5.pdf", "sha256": "5d47f520ed18acb4d1d94170f42676ae7e2ce067579731abd13d0153b30ec7c7", "redistribution_status": "public_domain_source_scan"}],
      "findings": ["Part of the five-volume 2019 baseline that superseded MIL-STD-883K Change 3."],
      "limitations": ["Does not establish parity with the MIL-STD-883 revision contemporaneous with the 1995 handbook."]
    },
    {
      "id": "mil-std-883l-change-1-2025",
      "document_number": "MIL-STD-883L Change 1",
      "accession": null,
      "title": "Microcircuits",
      "date": "2025-06-27",
      "authority": "United States Department of Defense",
      "authority_role": "later_context",
      "relationship": "Current-edition context used only to interpret modern class terminology.",
      "supports": ["modern MIL-STD-883 class terminology"],